[
  {
    "schemaVersion": "1.0",
    "code": "FORM-ACCESS-REQUEST",
    "name": "Yêu cầu cấp tài khoản và quyền",
    "jsonSchema": {
      "type": "object",
      "required": [
        "title",
        "requester",
        "department",
        "priority",
        "description",
        "target_user",
        "request_type",
        "systems",
        "requested_roles",
        "effective_from",
        "business_reason"
      ],
      "properties": {
        "title": {
          "type": "string",
          "title": "Tiêu đề",
          "description": "Ngắn gọn, dễ tìm"
        },
        "requester": {
          "type": "string",
          "title": "Người đề nghị",
          "description": "Tự động theo tài khoản"
        },
        "department": {
          "type": "string",
          "title": "Đơn vị",
          "description": "Từ HR projection"
        },
        "priority": {
          "type": "string",
          "title": "Ưu tiên",
          "description": "Bình thường/Cao/Khẩn"
        },
        "description": {
          "type": "string",
          "title": "Mô tả chi tiết",
          "description": "Nhu cầu và kết quả mong muốn"
        },
        "attachments": {
          "type": "string",
          "title": "Tệp đính kèm",
          "description": "Theo yêu cầu thủ tục"
        },
        "target_user": {
          "type": "string",
          "title": "Người được cấp"
        },
        "request_type": {
          "type": "string",
          "title": "Loại thao tác",
          "description": "Cấp/Đổi/Thu hồi"
        },
        "systems": {
          "type": "string",
          "title": "Hệ thống"
        },
        "requested_roles": {
          "type": "string",
          "title": "Vai trò đề nghị"
        },
        "effective_from": {
          "type": "string",
          "title": "Hiệu lực từ"
        },
        "effective_to": {
          "type": "string",
          "title": "Hiệu lực đến"
        },
        "business_reason": {
          "type": "string",
          "title": "Lý do"
        }
      }
    },
    "uiSchema": {
      "title": {
        "ui:help": "Gợi ý giá trị, giải thích trường hoặc kiểm tra logic khi được yêu cầu."
      },
      "requester": {
        "ui:help": "Gợi ý giá trị, giải thích trường hoặc kiểm tra logic khi được yêu cầu."
      },
      "department": {
        "ui:help": "Gợi ý giá trị, giải thích trường hoặc kiểm tra logic khi được yêu cầu."
      },
      "priority": {
        "ui:help": "Gợi ý giá trị, giải thích trường hoặc kiểm tra logic khi được yêu cầu."
      },
      "description": {
        "ui:widget": "textarea",
        "ui:help": "Viết lại rõ ràng và trích mục tiêu."
      },
      "attachments": {
        "ui:help": "Kiểm tra hồ sơ còn thiếu."
      },
      "target_user": {
        "ui:help": "Gợi ý giá trị, giải thích trường hoặc kiểm tra logic khi được yêu cầu."
      },
      "request_type": {
        "ui:help": "Gợi ý giá trị, giải thích trường hoặc kiểm tra logic khi được yêu cầu."
      },
      "systems": {
        "ui:help": "Gợi ý giá trị, giải thích trường hoặc kiểm tra logic khi được yêu cầu."
      },
      "requested_roles": {
        "ui:help": "Gợi ý quyền tối thiểu."
      },
      "effective_from": {
        "ui:help": "Gợi ý giá trị, giải thích trường hoặc kiểm tra logic khi được yêu cầu."
      },
      "effective_to": {
        "ui:help": "Gợi ý giá trị, giải thích trường hoặc kiểm tra logic khi được yêu cầu."
      },
      "business_reason": {
        "ui:widget": "textarea",
        "ui:help": "Gợi ý giá trị, giải thích trường hoặc kiểm tra logic khi được yêu cầu."
      }
    },
    "rules": [],
    "metadata": {
      "tenantSlug": "xtech",
      "procedureCode": "PILOT-06"
    }
  },
  {
    "schemaVersion": "1.0",
    "code": "FORM-ADMIN-REQUEST",
    "name": "Yêu cầu hành chính",
    "jsonSchema": {
      "type": "object",
      "required": [
        "title",
        "requester",
        "department",
        "priority",
        "description",
        "service_category",
        "needed_by"
      ],
      "properties": {
        "title": {
          "type": "string",
          "title": "Tiêu đề",
          "description": "Ngắn gọn, dễ tìm"
        },
        "requester": {
          "type": "string",
          "title": "Người đề nghị",
          "description": "Tự động theo tài khoản"
        },
        "department": {
          "type": "string",
          "title": "Đơn vị",
          "description": "Từ HR projection"
        },
        "priority": {
          "type": "string",
          "title": "Ưu tiên",
          "description": "Bình thường/Cao/Khẩn"
        },
        "description": {
          "type": "string",
          "title": "Mô tả chi tiết",
          "description": "Nhu cầu và kết quả mong muốn"
        },
        "attachments": {
          "type": "string",
          "title": "Tệp đính kèm",
          "description": "Theo yêu cầu thủ tục"
        },
        "service_category": {
          "type": "string",
          "title": "Nhóm dịch vụ"
        },
        "location": {
          "type": "string",
          "title": "Địa điểm"
        },
        "needed_by": {
          "type": "string",
          "title": "Hạn hoàn thành"
        },
        "estimated_cost": {
          "type": "number",
          "title": "Chi phí dự kiến",
          "description": "VND"
        },
        "checklist": {
          "type": "string",
          "title": "Danh sách yêu cầu"
        }
      }
    },
    "uiSchema": {
      "title": {
        "ui:help": "Gợi ý giá trị, giải thích trường hoặc kiểm tra logic khi được yêu cầu."
      },
      "requester": {
        "ui:help": "Gợi ý giá trị, giải thích trường hoặc kiểm tra logic khi được yêu cầu."
      },
      "department": {
        "ui:help": "Gợi ý giá trị, giải thích trường hoặc kiểm tra logic khi được yêu cầu."
      },
      "priority": {
        "ui:help": "Gợi ý giá trị, giải thích trường hoặc kiểm tra logic khi được yêu cầu."
      },
      "description": {
        "ui:widget": "textarea",
        "ui:help": "Viết lại rõ ràng và trích mục tiêu."
      },
      "attachments": {
        "ui:help": "Kiểm tra hồ sơ còn thiếu."
      },
      "service_category": {
        "ui:help": "Gợi ý giá trị, giải thích trường hoặc kiểm tra logic khi được yêu cầu."
      },
      "location": {
        "ui:help": "Gợi ý giá trị, giải thích trường hoặc kiểm tra logic khi được yêu cầu."
      },
      "needed_by": {
        "ui:help": "Gợi ý giá trị, giải thích trường hoặc kiểm tra logic khi được yêu cầu."
      },
      "estimated_cost": {
        "ui:help": "Gợi ý giá trị, giải thích trường hoặc kiểm tra logic khi được yêu cầu."
      },
      "checklist": {
        "ui:help": "Gợi ý giá trị, giải thích trường hoặc kiểm tra logic khi được yêu cầu."
      }
    },
    "rules": [],
    "metadata": {
      "tenantSlug": "xtech",
      "procedureCode": "PILOT-08"
    }
  },
  {
    "schemaVersion": "1.0",
    "code": "FORM-ASSET-ALLOCATION-REQUEST",
    "name": "Đề nghị cấp tài sản",
    "jsonSchema": {
      "type": "object",
      "required": [
        "title",
        "requester",
        "department",
        "priority",
        "description",
        "action_type",
        "asset_category",
        "specification",
        "quantity",
        "needed_by"
      ],
      "properties": {
        "title": {
          "type": "string",
          "title": "Tiêu đề",
          "description": "Ngắn gọn, dễ tìm"
        },
        "requester": {
          "type": "string",
          "title": "Người đề nghị",
          "description": "Tự động theo tài khoản"
        },
        "department": {
          "type": "string",
          "title": "Đơn vị",
          "description": "Từ HR projection"
        },
        "priority": {
          "type": "string",
          "title": "Ưu tiên",
          "description": "Bình thường/Cao/Khẩn"
        },
        "description": {
          "type": "string",
          "title": "Mô tả chi tiết",
          "description": "Nhu cầu và kết quả mong muốn"
        },
        "attachments": {
          "type": "string",
          "title": "Tệp đính kèm",
          "description": "Theo yêu cầu thủ tục"
        },
        "action_type": {
          "type": "string",
          "title": "Loại yêu cầu",
          "description": "Cấp mới/Đổi/Thu hồi"
        },
        "asset_category": {
          "type": "string",
          "title": "Nhóm tài sản",
          "description": "FinERP"
        },
        "specification": {
          "type": "string",
          "title": "Cấu hình"
        },
        "quantity": {
          "type": "number",
          "title": "Số lượng"
        },
        "needed_by": {
          "type": "string",
          "title": "Ngày cần",
          "format": "date"
        },
        "existing_asset": {
          "type": "string",
          "title": "Tài sản hiện tại"
        }
      }
    },
    "uiSchema": {
      "title": {
        "ui:help": "Gợi ý giá trị, giải thích trường hoặc kiểm tra logic khi được yêu cầu."
      },
      "requester": {
        "ui:help": "Gợi ý giá trị, giải thích trường hoặc kiểm tra logic khi được yêu cầu."
      },
      "department": {
        "ui:help": "Gợi ý giá trị, giải thích trường hoặc kiểm tra logic khi được yêu cầu."
      },
      "priority": {
        "ui:help": "Gợi ý giá trị, giải thích trường hoặc kiểm tra logic khi được yêu cầu."
      },
      "description": {
        "ui:widget": "textarea",
        "ui:help": "Viết lại rõ ràng và trích mục tiêu."
      },
      "attachments": {
        "ui:help": "Kiểm tra hồ sơ còn thiếu."
      },
      "action_type": {
        "ui:help": "Gợi ý giá trị, giải thích trường hoặc kiểm tra logic khi được yêu cầu."
      },
      "asset_category": {
        "ui:help": "Gợi ý giá trị, giải thích trường hoặc kiểm tra logic khi được yêu cầu."
      },
      "specification": {
        "ui:widget": "textarea",